{
    "$schema": "https://raw.githubusercontent.com/Outsmart-OOH/ooh_open_direct/master/schema/v1/uris/orders/orders_request.json",
    "Id":"orderid",
    "AccountId": "23873345",
    "AdvertiserBrandId": "73",
    "Currency": "GBP",
    "EndDate": "2014-12-24T18:00:00.000Z",
    "Name": "My Order",
    "OOHProviderData": 
        {
            "CampaignId": "B007",
            "CampaignName": "BARTYTIME",
            "PoNumber": "",
            "SalesOrderReference": "SPEC123",
            "BarterOrganizationID": "BAR987",
            "Other":""
        },
    "StartDate": "2014-11-24T06:00:00.000Z"
} 
